Title,Abstract,Publication Date,Journal,Link,Authors,Citations,Cleaned_Abstract,Abstract_Spacy
Blockchain and Cryptocurrencies Model Techniques and Applications,"As an emerging decentralized architecture and distributed computing paradigm underlying Bitcoin other cryptocurrencies, blockchain has attracted intensive attention in both research applications recent years. The key advantage of this technology lies the fact that it enables establishment secured, trusted, autonomous ecosystems for various scenarios, especially better usage legacy devices, infrastructure, resources. In paper, we presented a systematic investigation cryptocurrencies. Related fundamental rationales, technical advantages, existing potential cryptocurrencies are discussed, six-layer reference model framework is proposed with detailed description each its six layers. Potential also addressed. Our aim here to provide guidance future along promising important direction.",25-07-2018,IEEE Transactions on Systems Man and Cybernetics Systems,https://doi.org/10.1109/tsmc.2018.2854904,"Yong Yuan, Fei‐Yue Wang",386,As an emerging decentralized architecture and distributed computing paradigm underlying Bitcoin other cryptocurrencies blockchain has attracted intensive attention in both research applications recent years The key advantage of this technology lies the fact that it enables establishment secured trusted autonomous ecosystems for various scenarios especially better usage legacy devices infrastructure resources In paper we presented a systematic investigation cryptocurrencies Related fundamental rationales technical advantages existing potential cryptocurrencies are discussed sixlayer reference model framework is proposed with detailed description each its six layers Potential also addressed Our aim here to provide guidance future along promising important direction,emerge decentralize architecture distribute compute paradigm underlie bitcoin cryptocurrencie blockchain attract intensive attention research application recent year key advantage technology lie fact enable establishment secure trust autonomous ecosystem scenario especially well usage legacy device infrastructure resource paper present systematic investigation cryptocurrencie relate fundamental rationale technical advantage exist potential cryptocurrencie discuss sixlayer reference model framework propose detailed description layer potential address aim provide guidance future promise important direction
A decentralized token economy How blockchain and cryptocurrency can revolutionize business,"As the underlying technology of bitcoin, blockchain is expected to create a new economic system by revolutionizing way we communicate over internet. Blockchain seeks improve information security and transparency sharing encrypted data among peer-to-peer (P2P) networks. Due its emphasis on trust, there increased demand for blockchain’s application in variety business sectors. The decentralized nature creates concept token economy which community’s revenue can be allocated actual content producers service users who value. This article looks at how cryptocurrencies are evolving interconnected, creating through different models. key that enables protocols establishment future, leading paradigm.",25-09-2019,Business Horizons,https://doi.org/10.1016/j.bushor.2019.08.003,Jei Young Lee,226,As the underlying technology of bitcoin blockchain is expected to create a new economic system by revolutionizing way we communicate over internet Blockchain seeks improve information security and transparency sharing encrypted data among peertopeer P2P networks Due its emphasis on trust there increased demand for blockchains application in variety business sectors The decentralized nature creates concept token economy which communitys revenue can be allocated actual content producers service users who value This article looks at how cryptocurrencies are evolving interconnected creating through different models key that enables protocols establishment future leading paradigm,underlie technology bitcoin blockchain expect create new economic system revolutionize way communicate internet blockchain seek improve information security transparency sharing encrypt datum peertopeer network emphasis trust increase demand blockchain application variety business sector decentralized nature create concept token economy communitys revenue allocate actual content producer service user value article look cryptocurrencie evolve interconnect create different model key enable protocol establishment future lead paradigm
Toward Privacy and Regulation in BlockchainBased Cryptocurrencies,"Privacy is supreme in cryptocurrencies since most users do not want to reveal their identities or the transaction amount financial transactions. Nevertheless, achieving privacy blockchain-based remains challenging blockchain by default a public ledger. For instance, Bitcoin provides builtin pseudonymity rather than true anonymity, which can be compromised analyzing Several solutions have been proposed enhance of Bitcoin. Unfortunately, full anonymity always desirable, because malicious are able conduct illegal transactions, such as money laundering and drug trading, under cover cryptocurrencies. As result, regulation very essential. In this article, we analyze issues investigate some existing privacy-enhancing techniques blockchain- based well privacy-focused altcoins. addition, review compare works dealing with Finally, propose two possible from top view balance One solution on decentralized group signature, manager responsible for building tracing real payer transaction. The other verifiable encryption, actively involved normal transactions but trace suspicious via an encrypted tag.",15-02-2019,IEEE Network,https://doi.org/10.1109/mnet.2019.1800271,"Yannan Li, Willy Susilo, Guomin Yang, Yong Yu, Xiaojiang Du, Dongxi Liu, Nadra Guizani",97,Privacy is supreme in cryptocurrencies since most users do not want to reveal their identities or the transaction amount financial transactions Nevertheless achieving privacy blockchainbased remains challenging blockchain by default a public ledger For instance Bitcoin provides builtin pseudonymity rather than true anonymity which can be compromised analyzing Several solutions have been proposed enhance of Bitcoin Unfortunately full anonymity always desirable because malicious are able conduct illegal transactions such as money laundering and drug trading under cover cryptocurrencies As result regulation very essential In this article we analyze issues investigate some existing privacyenhancing techniques blockchain based well privacyfocused altcoins addition review compare works dealing with Finally propose two possible from top view balance One solution on decentralized group signature manager responsible for building tracing real payer transaction The other verifiable encryption actively involved normal transactions but trace suspicious via an encrypted tag,privacy supreme cryptocurrencie user want reveal identity transaction financial transaction achieve privacy blockchainbase remain challenge blockchain default public ledger instance bitcoin provide builtin pseudonymity true anonymity compromise analyze solution propose enhance bitcoin unfortunately anonymity desirable malicious able conduct illegal transaction money laundering drug trading cover cryptocurrencie result regulation essential article analyze issue investigate exist privacyenhancing technique blockchain base privacyfocused altcoin addition review compare work deal finally propose possible view balance solution decentralized group signature manager responsible build trace real payer transaction verifiable encryption actively involve normal transaction trace suspicious encrypted tag
BigCrypto Big Data Blockchain and Cryptocurrency,"Cryptocurrency has been a trending topic over the past decade, pooling tremendous technological power and attracting investments valued trillions of dollars on global scale. The cryptocurrency technology its network have endowed with many superior features due to unique architecture, which also determined worldwide efficiency, applicability data intensive characteristics. This paper introduces summarises interactions between two significant concepts in digitalized world, i.e., Big Data. Both subjects are at forefront research, this focuses their convergence comprehensively reviews very recent applications developments after 2016. Accordingly, we aim present systematic review Data serve as one stop reference directory for researchers regard identifying research gaps directing future explorations.",19-10-2018,Big Data and Cognitive Computing,https://doi.org/10.3390/bdcc2040034,"Hossein Hassani, Xu Huang, Emmanuel Sirimal Silva",88,Cryptocurrency has been a trending topic over the past decade pooling tremendous technological power and attracting investments valued trillions of dollars on global scale The cryptocurrency technology its network have endowed with many superior features due to unique architecture which also determined worldwide efficiency applicability data intensive characteristics This paper introduces summarises interactions between two significant concepts in digitalized world ie Big Data Both subjects are at forefront research this focuses their convergence comprehensively reviews very recent applications developments after 2016 Accordingly we aim present systematic review Data serve as one stop reference directory for researchers regard identifying research gaps directing future explorations,cryptocurrency trend topic past decade pool tremendous technological power attract investment value trillion dollar global scale cryptocurrency technology network endow superior feature unique architecture determine worldwide efficiency applicability datum intensive characteristic paper introduce summarise interaction significant concept digitalized world ie big datum subject forefront research focus convergence comprehensively review recent application development accordingly aim present systematic review datum serve stop reference directory researcher regard identify research gap direct future exploration
Toward Characterizing BlockchainBased Cryptocurrencies for Highly Accurate Predictions,"Recently, the Blockchain-based cryptocurrency market witnessed enormous growth. Bitcoin, leading cryptocurrency, reached all-time highs many times over year to speculations explain trend in its In this article, we study Bitcoin and Ethereum explore features their network that price hikes. We gather data analyze user activity highly impact of these cryptocurrencies. monitor change activities time relate them economic theories. identify key help us determine demand supply dynamics a cryptocurrency. Finally, use machine learning methods construct models predict price. Based on our experimental results using two large datasets for validation, confirm approach provides an accuracy up 99% prediction both instances.",01-03-2020,IEEE Systems Journal,https://doi.org/10.1109/jsyst.2019.2927707,"Muhammad Saad, Jinchun Choi, DaeHun Nyang, Joongheon Kim, Aziz Mohaisen",117,Recently the Blockchainbased cryptocurrency market witnessed enormous growth Bitcoin leading cryptocurrency reached alltime highs many times over year to speculations explain trend in its In this article we study Bitcoin and Ethereum explore features their network that price hikes We gather data analyze user activity highly impact of these cryptocurrencies monitor change activities time relate them economic theories identify key help us determine demand supply dynamics a cryptocurrency Finally use machine learning methods construct models predict price Based on our experimental results using two large datasets for validation confirm approach provides an accuracy up 99 prediction both instances,recently blockchainbase cryptocurrency market witness enormous growth bitcoin lead cryptocurrency reach alltime high time year speculation explain trend article study bitcoin ethereum explore feature network price hike gather datum analyze user activity highly impact cryptocurrencie monitor change activity time relate economic theory identify key help determine demand supply dynamic cryptocurrency finally use machine learning method construct model predict price base experimental result large dataset validation confirm approach provide accuracy prediction instance
HOW BLOCKCHAIN AND CRYPTOCURRENCY TECHNOLOGY COULD REVOLUTIONIZE ONLINE GAMBLING,"Gaming Law ReviewVol. 21, No. 7 ArticlesHOW BLOCKCHAIN AND CRYPTOCURRENCY TECHNOLOGY COULD REVOLUTIONIZE ONLINE GAMBLINGSally M. Gainsbury and Alex BlaszczynskiSally GainsburySearch for more papers by this author BlaszczynskiSearch authorPublished Online:1 Sep 2017https://doi.org/10.1089/glr2.2017.2174AboutSectionsView articleView Full TextPDF/EPUB Permissions & CitationsPermissionsDownload CitationsTrack CitationsAdd to favorites Back To Publication ShareShare onFacebookTwitterLinked InRedditEmail View articleFiguresReferencesRelatedDetailsCited byRelationship of Cryptocurrencies with Gambling Addiction30 June 2023 | Psikiyatride Guncel Yaklasimlar - Current Approaches in Psychiatry, Vol. 15, 2Cryptocurrencies as Gamblified Financial Assets Cryptocasinos: Novel Risks a Public Health Approach Gambling22 February Risks, 11, 3A privacy-preserving framework blockchain-based multi-level marketingComputers Industrial Engineering, 177Skin Contributes Problems Harm After Controlling Other Forms Traditional Gambling25 2022 Journal Studies, 39, 1Towards blockchain led decentralized autonomous organization (DAO) business model innovations16 March Benchmarking: An International Journal, 30, 2The evolution young gambling studies: digital convergence gaming, cryptocurrency technologies31 January 23Blockchain Its Integration IoT14 October 2022How Blockchain Is Transforming Accounting, Auditing Finance: A Systematic Review4 2023The interrelations gambling: Results from representative surveyComputers Human Behavior, 138Profile Behaviour Crypto Adopters – Evidence Macedonian Population Survey23 December South East European Economics Business, 17, 2fenómeno cripto y su proyección social publicitaria7 November VISUAL REVIEW. Visual Culture Review / Revista Internacional de Cultura Visual, 9, MonográficoVictimisation investors fraudulent investment schemes their protection through financial education11 Crime, 7Blockchain technology: catalyst reverse logistics the automobile industry19 August Smart Sustainable Built Environment, 82FİNANS SEKTÖRÜNDE BAZI DAVRANIŞSAL BAĞIMLILIKLAR; PATOLOJİK TİCARET, SORUNLU BORSA VE KRİPTO PARA KULLANIMI15 May Sosyal Bilimler Akademi DergisiBlockchain Contracts13 2022Universal Wallets8 Business Information Systems 64, 1Securing Big Data-Based Applications Using Technology18 2022A Based Methodology Power Grid Control Systems11 2022Demystifying Role Technology Healthcare TransactionCryptocurrency trading, problem gamblingAddictive Behaviors, 122Technology assessment: Enabling hospitality tourism sectorsTechnological Forecasting Social Change, 169The psychology trading: Risk protective factorsJournal Behavioral Addictions, 10, application technology industry13 2021 Asia Pacific Marketing Logistics, 33, 7Gambling Strategies Internet: What Do We Know? Review26 Frontiers 12Blockchain Future Securities Exchanges1 2021Inside decentralised casino: longitudinal study actual transactions28 2020 PLOS ONE, 10Blockchain disruptive business: systematic reviewInternational Management, 51A Literature Gap Analysis Emerging Technologies New Trends Gambling23 Environmental Research Health, 3Crypt currency an object accounting21 Economics. Finances. Law, 1, 381A Three-Tier Framework Understanding Disruption Trajectories Electricity IndustryIEEE Access, 8The role institutions gambling14 2019 19, 3Preliminary findings on trading among regular gamblers: new risk gambling?Addictive 92Blockchain Industries: SurveyIEEE 7The Governance Dispute ResolutionSSRN Electronic JournalHow can legislators protect sport integrity threat posed cryptocurrencies?22 2018 The Sports 18, 1-2 Volume 21Issue 7Sep 2017 InformationCopyright 2017, Mary Ann Liebert, Inc.To cite article:Sally Blaszczynski.HOW GAMBLING.Gaming Review.Sep 2017.482-492.http://doi.org/10.1089/glr2.2017.2174Published Volume: 21 Issue 7: September 2017KeywordsgamblingblockchainbitcoinregulationInternet gamblingtechnologyPDF download",01-09-2017,Gaming Law Review,https://doi.org/10.1089/glr2.2017.2174,"Sally Gainsbury, Alex Blaszczynski",66,Gaming Law ReviewVol 21 No 7 ArticlesHOW BLOCKCHAIN AND CRYPTOCURRENCY TECHNOLOGY COULD REVOLUTIONIZE ONLINE GAMBLINGSally M Gainsbury and Alex BlaszczynskiSally GainsburySearch for more papers by this author BlaszczynskiSearch authorPublished Online1 Sep 2017httpsdoiorg101089glr220172174AboutSectionsView articleView Full TextPDFEPUB Permissions  CitationsPermissionsDownload CitationsTrack CitationsAdd to favorites Back To Publication ShareShare onFacebookTwitterLinked InRedditEmail View articleFiguresReferencesRelatedDetailsCited byRelationship of Cryptocurrencies with Gambling Addiction30 June 2023  Psikiyatride Guncel Yaklasimlar  Current Approaches in Psychiatry Vol 15 2Cryptocurrencies as Gamblified Financial Assets Cryptocasinos Novel Risks a Public Health Approach Gambling22 February Risks 11 3A privacypreserving framework blockchainbased multilevel marketingComputers Industrial Engineering 177Skin Contributes Problems Harm After Controlling Other Forms Traditional Gambling25 2022 Journal Studies 39 1Towards blockchain led decentralized autonomous organization DAO business model innovations16 March Benchmarking An International Journal 30 2The evolution young gambling studies digital convergence gaming cryptocurrency technologies31 January 23Blockchain Its Integration IoT14 October 2022How Blockchain Is Transforming Accounting Auditing Finance A Systematic Review4 2023The interrelations gambling Results from representative surveyComputers Human Behavior 138Profile Behaviour Crypto Adopters  Evidence Macedonian Population Survey23 December South East European Economics Business 17 2fenmeno cripto y su proyeccin social publicitaria7 November VISUAL REVIEW Visual Culture Review  Revista Internacional de Cultura Visual 9 MonogrficoVictimisation investors fraudulent investment schemes their protection through financial education11 Crime 7Blockchain technology catalyst reverse logistics the automobile industry19 August Smart Sustainable Built Environment 82FNANS SEKTRNDE BAZI DAVRANISAL BAIMLILIKLAR PATOLOJK TCARET SORUNLU BORSA VE KRPTO PARA KULLANIMI15 May Sosyal Bilimler Akademi DergisiBlockchain Contracts13 2022Universal Wallets8 Business Information Systems 64 1Securing Big DataBased Applications Using Technology18 2022A Based Methodology Power Grid Control Systems11 2022Demystifying Role Technology Healthcare TransactionCryptocurrency trading problem gamblingAddictive Behaviors 122Technology assessment Enabling hospitality tourism sectorsTechnological Forecasting Social Change 169The psychology trading Risk protective factorsJournal Behavioral Addictions 10 application technology industry13 2021 Asia Pacific Marketing Logistics 33 7Gambling Strategies Internet What Do We Know Review26 Frontiers 12Blockchain Future Securities Exchanges1 2021Inside decentralised casino longitudinal study actual transactions28 2020 PLOS ONE 10Blockchain disruptive business systematic reviewInternational Management 51A Literature Gap Analysis Emerging Technologies New Trends Gambling23 Environmental Research Health 3Crypt currency an object accounting21 Economics Finances Law 1 381A ThreeTier Framework Understanding Disruption Trajectories Electricity IndustryIEEE Access 8The role institutions gambling14 2019 19 3Preliminary findings on trading among regular gamblers new risk gamblingAddictive 92Blockchain Industries SurveyIEEE 7The Governance Dispute ResolutionSSRN Electronic JournalHow can legislators protect sport integrity threat posed cryptocurrencies22 2018 The Sports 18 12 Volume 21Issue 7Sep 2017 InformationCopyright 2017 Mary Ann Liebert IncTo cite articleSally BlaszczynskiHOW GAMBLINGGaming ReviewSep 2017482492httpdoiorg101089glr220172174Published Volume 21 Issue 7 September 2017KeywordsgamblingblockchainbitcoinregulationInternet gamblingtechnologyPDF download,gaming law reviewvol articleshow blockchain cryptocurrency technology revolutionize online gamblingsally m gainsbury alex blaszczynskisally gainsburysearch paper author blaszczynskisearch authorpublishe sep articleview textpdfepub permission citationspermissionsdownload citationstrack citationsadd favorite publication shareshare onfacebooktwitterlinke inredditemail view articlefiguresreferencesrelateddetailscited byrelationship cryptocurrencie gambling june psikiyatride guncel yaklasimlar current approach psychiatry vol gamblifie financial asset cryptocasino novel risk public health approach february risk privacypreserve framework blockchainbase multilevel marketingcomputer industrial engineering contribute problem harm control form traditional journal study blockchain lead decentralize autonomous organization dao business model march benchmarke international journal evolution young gambling study digital convergence gaming cryptocurrency january integration october blockchain transform accounting auditing finance systematic interrelation gambling result representative surveycomputer human behavior behaviour crypto adopter evidence macedonian population december south east european economics business cripto y su proyeccin social november visual review visual culture review revista internacional de cultura visual monogrficovictimisation investor fraudulent investment scheme protection financial crime technology catalyst reverse logistic automobile august smart sustainable build environment sektrnde bazi davranisal baimliliklar patolojk tcaret sorunlu borsa ve krpto para sosyal bilimler akademi dergisiblockchain business information system big database application base methodology power grid control role technology healthcare transactioncryptocurrency trading problem gamblingaddictive behavior assessment enable hospitality tourism sectorstechnological forecasting social change psychology trading risk protective factorsjournal behavioral addiction application technology asia pacific marketing logistic strategy internet know frontier future security decentralise casino longitudinal study actual plo disruptive business systematic reviewinternational management literature gap analysis emerge technology new trend environmental research health currency object economic finance law threeti framework understand disruption trajectory electricity industryieee access role institution finding trading regular gambler new risk gamblingaddictive industry surveyieee governance dispute resolutionssrn electronic journalhow legislator protect sport integrity threat pose sport volume informationcopyright mary ann liebert incto cite articlesally blaszczynskihow gamblinggame reviewsep volume issue september gamblingtechnologypdf download
