Title,Abstract,Publication Date,Journal,Link,Authors,Citations,Cleaned_Abstract,Abstract_Spacy
Evading Capital Controls via Cryptocurrencies Evidence from the Blockchain,"How pervasive is the use of cryptocurrencies to evade capital controls? We develop a new method that exploits blockchain data identify cross-border flows circumvent controls via cryptocurrencies. Applying China, we find aggregate volume flight over quarter Chinese Bitcoin exchange volume. Capital from China positively associated with economic policy uncertainty and premium in Yuan, inconsistent triangular arbitrage. Individuals engaging are less likely trade illegal goods or services, suggesting has different motivations other criminal activity. Our findings suggest indeed provide way circumventing controls.",01-01-2020,SSRN Electronic Journal,https://doi.org/10.2139/ssrn.3956933,"Maggie Hu, Adrian D. Lee, Tālis J. Putniņš",8,How pervasive is the use of cryptocurrencies to evade capital controls We develop a new method that exploits blockchain data identify crossborder flows circumvent controls via cryptocurrencies Applying China we find aggregate volume flight over quarter Chinese Bitcoin exchange volume Capital from China positively associated with economic policy uncertainty and premium in Yuan inconsistent triangular arbitrage Individuals engaging are less likely trade illegal goods or services suggesting has different motivations other criminal activity Our findings suggest indeed provide way circumventing controls,pervasive use cryptocurrencie evade capital control develop new method exploit blockchain datum identify crossborder flow circumvent control cryptocurrencie apply china find aggregate volume flight quarter chinese bitcoin exchange volume capital china positively associate economic policy uncertainty premium yuan inconsistent triangular arbitrage individual engage likely trade illegal good service suggest different motivation criminal activity finding suggest provide way circumvent control
The Rise of the Digital Economy Thoughts on Blockchain Technology and Cryptocurrencies for the Collaborative Economy,"This study highlights the potential impacts of blockchain technology on collaborative economy, more colloquially known as sharing economy. First, this conceptual review analyzes how economy intersects with technology. Collaborative consumption involves an intensification peer-to-peer trade underpinned by robust digital infrastructures and processes, hence increased use new technologies a redefinition business activities. As inherently connected is therefore prone to integrate most recent technological advances including artificial intelligence, big data analytics, augmented reality, smart grid, Second, furthers examination organizational managerial implications related in terms governance, transaction costs user confidence. A closing case will finally examine role prominent social networking site (i.e., Facebook) collaborative-blockchain nexus.",01-01-2019,SSRN Electronic Journal,https://doi.org/10.2139/ssrn.3502730,"Myriam Ertz, Émilie Boily",9,This study highlights the potential impacts of blockchain technology on collaborative economy more colloquially known as sharing economy First this conceptual review analyzes how economy intersects with technology Collaborative consumption involves an intensification peertopeer trade underpinned by robust digital infrastructures and processes hence increased use new technologies a redefinition business activities As inherently connected is therefore prone to integrate most recent technological advances including artificial intelligence big data analytics augmented reality smart grid Second furthers examination organizational managerial implications related in terms governance transaction costs user confidence A closing case will finally examine role prominent social networking site ie Facebook collaborativeblockchain nexus,study highlight potential impact blockchain technology collaborative economy colloquially know share economy conceptual review analyze economy intersect technology collaborative consumption involve intensification peertopeer trade underpin robust digital infrastructure process increase use new technology redefinition business activity inherently connect prone integrate recent technological advance include artificial intelligence big data analytic augment reality smart grid second further examination organizational managerial implication relate term governance transaction cost user confidence closing case finally examine role prominent social networking site ie facebook collaborativeblockchain nexus
Game theory based compatible incentive mechanism design for noncryptocurrency blockchain systems,"With the success of Bitcoin, nowadays, both academia and industry have been focusing on expansion blockchain in non-cryptocurrency applications to facilitate development Industry 4.0. The incentive mechanism blockchain, which encourages miners participate validation processes, is important maintenance system. However, techniques, are widely applied existing systems, not suitable for with business models become a major issue that undermines adoption blockchain. In this paper, we propose compatible encourage validators' actions align consensus algorithm. works algorithm make technology more adaptable applications. proposed design matches voting-based Practical Byzantine Fault Tolerance (PBFT) adopted by most Game theory-based analysis conducted identify problems caused participants' misbehaviours. Meanwhile, based game theory develop our satisfies compatibility requirement. Both mathematical proof simulation experiments used evaluate design. results demonstrate desired honest behaviour among validators so can be maintained",01-02-2023,Journal of Industrial Information Integration,https://doi.org/10.1016/j.jii.2022.100426,"Xiang Li, Qing Liu, Shiqing Wu, Zehong Cao, Quan Bai",13,With the success of Bitcoin nowadays both academia and industry have been focusing on expansion blockchain in noncryptocurrency applications to facilitate development Industry 40 The incentive mechanism blockchain which encourages miners participate validation processes is important maintenance system However techniques are widely applied existing systems not suitable for with business models become a major issue that undermines adoption blockchain In this paper we propose compatible encourage validators actions align consensus algorithm works algorithm make technology more adaptable applications proposed design matches votingbased Practical Byzantine Fault Tolerance PBFT adopted by most Game theorybased analysis conducted identify problems caused participants misbehaviours Meanwhile based game theory develop our satisfies compatibility requirement Both mathematical proof simulation experiments used evaluate design results demonstrate desired honest behaviour among validators so can be maintained,success bitcoin nowadays academia industry focus expansion blockchain noncryptocurrency application facilitate development industry incentive mechanism blockchain encourage miner participate validation process important maintenance system technique widely apply exist system suitable business model major issue undermine adoption blockchain paper propose compatible encourage validator action align consensus algorithm work algorithm technology adaptable application propose design match votingbase practical byzantine fault tolerance pbft adopt game theorybase analysis conduct identify problem cause participant misbehaviour base game theory develop satisfie compatibility requirement mathematical proof simulation experiment evaluate design result demonstrate desire honest behaviour validator maintain
Mining Process in Cryptocurrency Using Blockchain Technology Bitcoin as a Case Study,"A new digital currency in the form virtual cash, known as Bitcoin was acquainted with world by Satoshi 2009. is most notable computerized money. It based on peer-to-peer distributed system no central authority controlling it. technique Blockchain, a kind of ledger containing record all transactions. All set transactions are logged blocks. The generated users broadcasted using signed blocks to verify over network. transaction verified mining process and added Blockchain. In order add into block, miner solves cryptographic puzzle. miners rewarded for their work. This paper focused strategy reward mechanism Bitcoin. challenges identified probable solutions presented.",01-10-2019,Journal of Computational and Theoretical Nanoscience,https://doi.org/10.1166/jctn.2019.8515,"Ahmad Abdullah Aljabr, Avinash Sharma, Kailash Kumar",8,A new digital currency in the form virtual cash known as Bitcoin was acquainted with world by Satoshi 2009 is most notable computerized money It based on peertopeer distributed system no central authority controlling it technique Blockchain a kind of ledger containing record all transactions All set transactions are logged blocks The generated users broadcasted using signed blocks to verify over network transaction verified mining process and added Blockchain In order add into block miner solves cryptographic puzzle miners rewarded for their work This paper focused strategy reward mechanism Bitcoin challenges identified probable solutions presented,new digital currency form virtual cash know bitcoin acquaint world satoshi notable computerized money base peertopeer distribute system central authority control technique blockchain kind ledger contain record transaction set transaction log block generate user broadcast sign block verify network transaction verify mining process add blockchain order add block miner solve cryptographic puzzle miner reward work paper focus strategy reward mechanism bitcoin challenge identify probable solution present
Blockchain Research Beyond Cryptocurrencies,"One of the key requirements a properly functioning digital society is implementation decentralized identity management scheme through which every citizen can be uniquely determined. Specifically, we believe what required for PKI to deployed at global scale. A consists collection certificates that cryptographically bind an individual's their public key. In this article, present overview our recent work in areas and privacy, with specific emphasis on deployment blockchain backed PKI. Once place, are position perform number common network tasks much more securely efficiently than do currently.",01-12-2019,IEEE Communications Standards Magazine,https://doi.org/10.1109/mcomstd.001.1900026,Hitesh Tewari,4,One of the key requirements a properly functioning digital society is implementation decentralized identity management scheme through which every citizen can be uniquely determined Specifically we believe what required for PKI to deployed at global scale A consists collection certificates that cryptographically bind an individuals their public key In this article present overview our recent work in areas and privacy with specific emphasis on deployment blockchain backed PKI Once place are position perform number common network tasks much more securely efficiently than do currently,key requirement properly function digital society implementation decentralize identity management scheme citizen uniquely determine specifically believe require pki deploy global scale consist collection certificate cryptographically bind individual public key article present overview recent work area privacy specific emphasis deployment blockchain back pki place position perform number common network task securely efficiently currently
Cryptocurrency and Blockchain,"This chapter provides an overview of cryptocurrency and the blockchain technology. A that is powered by decentralized computer technology has long been a dream for some pioneers such as Nick Szabo. In January 2009, Bitcoin was launched first ever practical in human history. The introduces history cryptocurrency, then describes design principle major components Bitcoin. Next, it outlines vision key Ethereum, which developed not aiming to compete directly with but instead, platform developing applications based on its smart contract implementation, turn Finally, presents common attacks",19-05-2021,From Traditional Fault Tolerance to Blockchain,https://doi.org/10.1002/9781119682127.ch8,Wenbing Zhao,3,This chapter provides an overview of cryptocurrency and the blockchain technology A that is powered by decentralized computer technology has long been a dream for some pioneers such as Nick Szabo In January 2009 Bitcoin was launched first ever practical in human history The introduces history cryptocurrency then describes design principle major components Bitcoin Next it outlines vision key Ethereum which developed not aiming to compete directly with but instead platform developing applications based on its smart contract implementation turn Finally presents common attacks,chapter provide overview cryptocurrency blockchain technology power decentralized computer technology long dream pioneer nick szabo january bitcoin launch practical human history introduce history cryptocurrency describe design principle major component bitcoin outline vision key ethereum developed aim compete directly instead platform develop application base smart contract implementation turn finally present common attack
Cryptocurrencies and Blockchain Opportunities and Limits of a New Monetary Regime,"Cryptocurrency innovations such as Bitcoin raise the question of possible transformation monetary regime and how it would operate. The blockchain technology underlying is said to be ""trustless"" because has been designed avoid a ""trusted third party."" Drawing on institutionalist approach Aglietta Orléan emphasizing importance trust in money system, we show that characterized by: (1) methodical through existence an objective proof payment; (2) hierarchical due concentration mining process; (3) ethical organized around rejection banks state, although early commitment unstable. In other words, now materialized form technical institution, blockchain. However, cannot used everyday bring about deflationist dysfunctional regime, well high transaction costs. Some cryptocurrencies could lead interesting transformations if they were provide new forms sovereignty, design based fixed supply, or central decided back them.",03-04-2019,International Journal of Political Economy,https://doi.org/10.1080/08911916.2019.1624320,"Léo Malherbe, Matthieu Montalban, Nicolas Bédu, Caroline Granier",6,Cryptocurrency innovations such as Bitcoin raise the question of possible transformation monetary regime and how it would operate The blockchain technology underlying is said to be trustless because has been designed avoid a trusted third party Drawing on institutionalist approach Aglietta Orlan emphasizing importance trust in money system we show that characterized by 1 methodical through existence an objective proof payment 2 hierarchical due concentration mining process 3 ethical organized around rejection banks state although early commitment unstable In other words now materialized form technical institution blockchain However cannot used everyday bring about deflationist dysfunctional regime well high transaction costs Some cryptocurrencies could lead interesting transformations if they were provide new forms sovereignty design based fixed supply or central decided back them,cryptocurrency innovation bitcoin raise question possible transformation monetary regime operate blockchain technology underlie say trustless design avoid trust party draw institutionalist approach aglietta orlan emphasize importance trust money system characterize methodical existence objective proof payment hierarchical concentration mining process ethical organize rejection bank state early commitment unstable word materialize form technical institution blockchain everyday bring deflationist dysfunctional regime high transaction cost cryptocurrencie lead interesting transformation provide new form sovereignty design base fix supply central decide
Monitoring Blockchain Cryptocurrency Transactions to Improve the Trustworthiness of the Fourth Industrial Revolution Industry 40,"A completely new economic system is required for the era of Industry 4.0. Blockchain technology and blockchain cryptocurrencies are best means to confront this trustless economy. Millions smart devices able complete transparent financial transactions via its related cryptocurrencies. However, technology, internet-connected may be hacked mine In regard, monitoring network these blockchain-based can very useful detect abnormal behavior users Therefore, trustworthiness assured. paper, a novel procedure proposed monitor cryptocurrency transactions. To do so, hidden Markov multi-linear tensor model (HMTM) utilized among nodes network. Then, multivariate exponentially weighted moving average (MEWMA) control chart applied latent effects. Average run length (ARL) used evaluate performance MEWMA in detecting anomalies. The real dataset Bitcoin",27-11-2020,Algorithms,https://doi.org/10.3390/a13120312,"Kamyar Sabri‐Laghaie, Saeid Jafarzadeh Ghoushchi, Fatemeh Elhambakhsh, Abbas Mardani",10,A completely new economic system is required for the era of Industry 40 Blockchain technology and blockchain cryptocurrencies are best means to confront this trustless economy Millions smart devices able complete transparent financial transactions via its related cryptocurrencies However technology internetconnected may be hacked mine In regard monitoring network these blockchainbased can very useful detect abnormal behavior users Therefore trustworthiness assured paper a novel procedure proposed monitor cryptocurrency transactions To do so hidden Markov multilinear tensor model HMTM utilized among nodes network Then multivariate exponentially weighted moving average MEWMA control chart applied latent effects Average run length ARL used evaluate performance MEWMA in detecting anomalies The real dataset Bitcoin,completely new economic system require era industry blockchain technology blockchain cryptocurrencie good mean confront trustless economy million smart device able complete transparent financial transaction related cryptocurrencie technology internetconnecte hack regard monitoring network blockchainbase useful detect abnormal behavior user trustworthiness assure paper novel procedure propose monitor cryptocurrency transaction hidden markov multilinear tensor model hmtm utilize nodes network multivariate exponentially weight move average mewma control chart apply latent effect average run length arl evaluate performance mewma detect anomaly real dataset bitcoin
A LowCost CrossBorder Payment System Based on Auditable Cryptocurrency With Consortium Blockchain Joint Digital Currency,"Due to the involvement of a large number intermediaries across different time zones in correspondent banking process, existing interbank payment systems cannot provide cost-effective cross-border transactions. They also suffer from lack transparency and long transaction delays. These issues can be solved by designing cryptocurrency an auditable manner using permissioned blockchain where group authorities govern network. In this paper, we propose low-cost, seamless system based on that enables unspent output-based transactions consortium To manage blockchain, participating countries execute energy-efficient proof authority consensus algorithm with equal rights. Unlike conventional cryptocurrencies, dynamic decentralized identifiers (DIDs) are used as transacting addresses so self-manageable authentication performed on-chain without any interaction trusted third party. The identity parties is known respective DID issuers only. This approach peer-to-peer while protecting user privacy ensuring jeopardizing auditability. For convenience, multi-party computation multi-signature protocols provided. was implemented Python, mechanism tested. paper help ongoing research blockchain-based solutions worldwide.",16-09-2022,IEEE Transactions on Services Computing,https://doi.org/10.1109/tsc.2022.3207224,"Md. Mainul Islam, Md. Kamrul Islam, Md. Shahjalal, Mostafa Zaman Chowdhury, Yeong Min Jang",16,Due to the involvement of a large number intermediaries across different time zones in correspondent banking process existing interbank payment systems cannot provide costeffective crossborder transactions They also suffer from lack transparency and long transaction delays These issues can be solved by designing cryptocurrency an auditable manner using permissioned blockchain where group authorities govern network In this paper we propose lowcost seamless system based on that enables unspent outputbased transactions consortium To manage blockchain participating countries execute energyefficient proof authority consensus algorithm with equal rights Unlike conventional cryptocurrencies dynamic decentralized identifiers DIDs are used as transacting addresses so selfmanageable authentication performed onchain without any interaction trusted third party The identity parties is known respective DID issuers only This approach peertopeer while protecting user privacy ensuring jeopardizing auditability For convenience multiparty computation multisignature protocols provided was implemented Python mechanism tested paper help ongoing research blockchainbased solutions worldwide,involvement large number intermediary different time zone correspondent banking process exist interbank payment system provide costeffective crossborder transaction suffer lack transparency long transaction delay issue solve design cryptocurrency auditable manner permissione blockchain group authority govern network paper propose lowcost seamless system base enable unspent outputbased transaction consortium manage blockchain participate country execute energyefficient proof authority consensus algorithm equal right unlike conventional cryptocurrencie dynamic decentralize identifier did transact address selfmanageable authentication perform onchain interaction trust party identity party know respective issuer approach peertopeer protect user privacy ensure jeopardize auditability convenience multiparty computation multisignature protocol provide implement python mechanism test paper help ongoing research blockchainbase solution worldwide
Blockchain technology and cryptocurrencies  legal and tax aspects,"The main objective of the paper is to provide an answer question whether new technologies such as blockchain that enter various spheres public life are safe for users and what impact they have on national legislations. Cryptocurrencies, which based technology, can be used a means payment, investment or capital accumulation. Therefore, becomes more popular. research method in consists analysis legislation jurisprudence well linguistic purposive interpretation affects functioning cryptocurrencies. introductory part contains general historical outline basic principles related technology. Real potential threats posed by discussed technology also governments or, broadly, international community, offer sufficient level protection against risks use Using streamline logistic activities speed up transactions useful itself, but hands private entities may pose risk losing funds if not properly secured. financial market should supervised controlled state guarantor economic freedom. Another vital legislators keep with advances It seems development triggers legal regulations. enters everyday life, documents appear form case law, provisions, opinions etc. role these regulate, define specify appear.",30-04-2019,ASEJ Scientific Journal of  BielskoBiala School of Finance and Law,https://doi.org/10.5604/01.3001.0013.2653,Tomasz Słapczyński,5,The main objective of the paper is to provide an answer question whether new technologies such as blockchain that enter various spheres public life are safe for users and what impact they have on national legislations Cryptocurrencies which based technology can be used a means payment investment or capital accumulation Therefore becomes more popular research method in consists analysis legislation jurisprudence well linguistic purposive interpretation affects functioning cryptocurrencies introductory part contains general historical outline basic principles related technology Real potential threats posed by discussed technology also governments or broadly international community offer sufficient level protection against risks use Using streamline logistic activities speed up transactions useful itself but hands private entities may pose risk losing funds if not properly secured financial market should supervised controlled state guarantor economic freedom Another vital legislators keep with advances It seems development triggers legal regulations enters everyday life documents appear form case law provisions opinions etc role these regulate define specify appear,main objective paper provide answer question new technology blockchain enter sphere public life safe user impact national legislation cryptocurrencie base technology mean payment investment capital accumulation popular research method consist analysis legislation jurisprudence linguistic purposive interpretation affect function cryptocurrencie introductory contain general historical outline basic principle relate technology real potential threat pose discuss technology government broadly international community offer sufficient level protection risk use streamline logistic activity speed transaction useful hand private entity pose risk lose fund properly secure financial market supervised control state guarantor economic freedom vital legislator advance development trigger legal regulation enter everyday life document appear form case law provision opinion etc role regulate define specify appear
