Title,Abstract,Publication Date,Journal,Link,Authors,Citations,Cleaned_Abstract,Abstract_Spacy
Environmental load from use of blockchain technology and cryptocurrency mining in Russia,"With the increasing use of information technologies (IT) their opportunities to ensure environmental sustainability and risks widespread adoption are growing. And if possibilities have been studied well enough, then paid attention relatively recently. However, awareness these is becoming increasingly important with spread technologies. Currently, there already hundreds cryptocurrencies, technological basis for many currencies blockchain—a digital ledger transactions. This article has assessed burden mining supporting transactions in cryptocurrency market Russia using CO2-equivalent. For this, first time, amount electricity consumed support was calculated, data on largest centres were collected systematized, main factors placement both large small private farms determined. Based a map created. Our analysis showed that average, 2.977 million tons CO2 equivalent emitted Bitcoin production Russia, total emissions from 4.466 equivalent. our damage, we believe when deciding blockchain technology, not only its capabilities should be taken into account, but also an assessment ratio potential benefits impact environment. A systematic understanding interrelated direct indirect impacts needed make decisions blockchain, since technology shows itself as potentially one most energy resource intensive.",01-01-2021,InterCarto InterGIS,https://doi.org/10.35595/2414-9179-2021-1-27-238-248,Olga Chereshnia,2,With the increasing use of information technologies IT their opportunities to ensure environmental sustainability and risks widespread adoption are growing And if possibilities have been studied well enough then paid attention relatively recently However awareness these is becoming increasingly important with spread technologies Currently there already hundreds cryptocurrencies technological basis for many currencies blockchaina digital ledger transactions This article has assessed burden mining supporting transactions in cryptocurrency market Russia using CO2equivalent For this first time amount electricity consumed support was calculated data on largest centres were collected systematized main factors placement both large small private farms determined Based a map created Our analysis showed that average 2977 million tons CO2 equivalent emitted Bitcoin production Russia total emissions from 4466 equivalent our damage we believe when deciding blockchain technology not only its capabilities should be taken into account but also an assessment ratio potential benefits impact environment A systematic understanding interrelated direct indirect impacts needed make decisions blockchain since technology shows itself as potentially one most energy resource intensive,increase use information technology opportunity ensure environmental sustainability risk widespread adoption grow possibility study pay attention relatively recently awareness increasingly important spread technology currently hundred cryptocurrencie technological basis currency blockchaina digital ledger transaction article assess burden mining support transaction cryptocurrency market russia time electricity consume support calculate datum large centre collect systematize main factor placement large small private farm determine base map create analysis show average million ton equivalent emit bitcoin production russia total emission equivalent damage believe decide blockchain technology capability take account assessment ratio potential benefit impact environment systematic understanding interrelate direct indirect impact need decision blockchain technology show potentially energy resource intensive
Blockchain Technology and Cryptocurrencies An Alternative to Central Banking,"Blockchain technology and its application to cryptocurrencies is gaining increasing importance in many sectors. Current events, including the hotly-debated announcement of launch Facebook’s digital currency ‘Libra’ illustrate that topic now as relevant ever. In present article, we investigate whether blockchain have potential one day replace or offer a serious alternative central banking traditional financial sector by illustrating how functions offering brief review 2008 global crisis light technology. Furthermore, stablecoins current events relating are discussed, along with gold-backed could serve capital asset. Finally, compliance risks demonstrated, re-enactment concrete steps criminals take launder their incriminated funds, finance terrorist groups bribe corrupt foreign officials.",01-01-2020,Lecture Notes in Networks and Systems,https://doi.org/10.1007/978-3-030-47945-9_164,"Fabian Teichmann, Marie-Christin Falker",1,Blockchain technology and its application to cryptocurrencies is gaining increasing importance in many sectors Current events including the hotlydebated announcement of launch Facebooks digital currency Libra illustrate that topic now as relevant ever In present article we investigate whether blockchain have potential one day replace or offer a serious alternative central banking traditional financial sector by illustrating how functions offering brief review 2008 global crisis light technology Furthermore stablecoins current events relating are discussed along with goldbacked could serve capital asset Finally compliance risks demonstrated reenactment concrete steps criminals take launder their incriminated funds finance terrorist groups bribe corrupt foreign officials,blockchain technology application cryptocurrencie gain increase importance sector current event include hotlydebate announcement launch facebook digital currency libra illustrate topic relevant present article investigate blockchain potential day replace offer alternative central banking traditional financial sector illustrate function offer brief review global crisis light technology furthermore stablecoin current event relate discuss goldbacke serve capital asset finally compliance risk demonstrate reenactment concrete step criminal launder incriminated fund finance terrorist group bribe corrupt foreign official
Blockchain metrics and indicators in cryptocurrency trading,"The objective of this paper is the construction new indicators that can be useful to operate in cryptocurrency market. These are based on public data obtained from blockchain network, specifically nodes make up Bitcoin mining. Therefore, our analysis unique network. results with numerical simulations algorithmic trading and prediction via statistical models Machine Learning demonstrate importance variables such as hash rate, difficulty mining or cost per transaction when it comes trade assets predict direction price. Variables network will called here metrics. corresponding (inspired by “Hash Ribbon”) perform well locating buy signals. From results, we conclude allow obtaining information a advantage highly volatile",01-01-2024,Chaos Solitons amp Fractals,https://doi.org/10.1016/j.chaos.2023.114305,"Jonathan King, Roberto Dale, José M. Amigó",1,The objective of this paper is the construction new indicators that can be useful to operate in cryptocurrency market These are based on public data obtained from blockchain network specifically nodes make up Bitcoin mining Therefore our analysis unique network results with numerical simulations algorithmic trading and prediction via statistical models Machine Learning demonstrate importance variables such as hash rate difficulty mining or cost per transaction when it comes trade assets predict direction price Variables network will called here metrics corresponding inspired by Hash Ribbon perform well locating buy signals From results we conclude allow obtaining information a advantage highly volatile,objective paper construction new indicator useful operate cryptocurrency market base public datum obtain blockchain network specifically nod bitcoin mining analysis unique network result numerical simulation algorithmic trading prediction statistical model machine learning demonstrate importance variable hash rate difficulty mining cost transaction come trade asset predict direction price variable network call metric corresponding inspire hash ribbon perform locate buy signal result conclude allow obtain information advantage highly volatile
A glance at blockchain technology and cryptocurrencies as an application,"Blockchain technology, which includes cryptocurrencies such as Bitcoin, Ethereum,…etc [1,2] has been evaluated an investment tool by many people all over the world in recent years, needs to be examined details, both mathematically and conceptually [8,9]. In fact, it can said that blockchain is characterized accounting system database based on distributed ledgers its most basic form, extremely secure terms of copying data or attacking. For this reason, we say technology a more effective security mechanism than any central state-of-the-art authoritative used today. However, almost impossible bring security, speed cost parameters their full extend at same time, cryptosystem, parameter from ledger structure adversely affects parameters. article, discuss cryptographic working principles cryptocurrencies, application field together with features structures blocks contained.",30-06-2022,MANAS Journal of Engineering,https://doi.org/10.51354/mjen.1034912,"Turgut Hanoymak, Ömer Küsmüş",1,Blockchain technology which includes cryptocurrencies such as Bitcoin Ethereumetc 12 has been evaluated an investment tool by many people all over the world in recent years needs to be examined details both mathematically and conceptually 89 In fact it can said that blockchain is characterized accounting system database based on distributed ledgers its most basic form extremely secure terms of copying data or attacking For this reason we say technology a more effective security mechanism than any central stateoftheart authoritative used today However almost impossible bring security speed cost parameters their full extend at same time cryptosystem parameter from ledger structure adversely affects parameters article discuss cryptographic working principles cryptocurrencies application field together with features structures blocks contained,blockchain technology include cryptocurrencie bitcoin ethereumetc evaluate investment tool people world recent year need examine detail mathematically conceptually fact said blockchain characterize accounting system database base distribute ledger basic form extremely secure term copy datum attack reason technology effective security mechanism central stateoftheart authoritative today impossible bring security speed cost parameter extend time cryptosystem parameter ledger structure adversely affect parameter article discuss cryptographic working principle cryptocurrencie application field feature structure block contain
Cryptocurrency with Blockchain Technology  A Literature Review,"Blockchain is a new and secured way to store data. Multiple computers connected form series of blocks that holds transaction data the information previous block. It technology used develop first cryptocurrency Bitcoin. generating opportunitiesin other industry domains along with financial sector. Thus, in this era, becomes future internet. The growing popularity cryptocurrencies as assets an indicator revolution led understanding need-to-know blockchain depth while investing money cryptocurrencies. In article, we will discuss evolving related cryptocurrency. We outline concept general strength weaknesses, real world use cases, trends more. Cryptocurrencies currently havesignificant commercial value sector, so knowing behind implementation help investors businesses easily predict market trends. This article provide overview its features by studying various research papers, articles, news media many",24-03-2023,2023 Somaiya International Conference on Technology and Information Management SICTIM,https://doi.org/10.1109/sictim56495.2023.10104971,"Leenata Jaymin Parab, Prashant P Nitnaware, Shweta A Patil",1,Blockchain is a new and secured way to store data Multiple computers connected form series of blocks that holds transaction data the information previous block It technology used develop first cryptocurrency Bitcoin generating opportunitiesin other industry domains along with financial sector Thus in this era becomes future internet The growing popularity cryptocurrencies as assets an indicator revolution led understanding needtoknow blockchain depth while investing money cryptocurrencies In article we will discuss evolving related cryptocurrency We outline concept general strength weaknesses real world use cases trends more Cryptocurrencies currently havesignificant commercial value sector so knowing behind implementation help investors businesses easily predict market trends This article provide overview its features by studying various research papers articles news media many,blockchain new secured way store datum multiple computer connect form series block hold transaction datum information previous block technology develop cryptocurrency bitcoin generating opportunitiesin industry domain financial sector era future internet grow popularity cryptocurrencie asset indicator revolution lead understand needtoknow blockchain depth invest money cryptocurrencie article discuss evolve relate cryptocurrency outline concept general strength weaknesse real world use case trend cryptocurrencie currently havesignificant commercial value sector know implementation help investor business easily predict market trend article provide overview feature study research paper article news medium
Corruption and Cryptocurrency  Blockchains as corruption tools,"Cryptocurrency has become ubiquitous and is evolving constantly. The question if our legal framework catching up with it. Therefore, this article analyzes the arguments on legitimacy legality of cryptocurrency in order to emphasize relation between corruption cryptocurrency. research enlightened some cogent possibility perpetrators committing acts through These basically refer unique characteristics such as quick value fluctuation, difficulties tractability lacking current legislation. features it may headline an immensely attractive environment for activities. Hence world already faced tangled scamming scandals specified herein. aim highlight be committed a form unknown before.",01-07-2022,Academicus International Scientific Journal,https://doi.org/10.7336/academicus.2022.26.06,"Adrianit Ibrahimi, Besa Arifi",1,Cryptocurrency has become ubiquitous and is evolving constantly The question if our legal framework catching up with it Therefore this article analyzes the arguments on legitimacy legality of cryptocurrency in order to emphasize relation between corruption cryptocurrency research enlightened some cogent possibility perpetrators committing acts through These basically refer unique characteristics such as quick value fluctuation difficulties tractability lacking current legislation features it may headline an immensely attractive environment for activities Hence world already faced tangled scamming scandals specified herein aim highlight be committed a form unknown before,cryptocurrency ubiquitous evolve constantly question legal framework catch article analyze argument legitimacy legality cryptocurrency order emphasize relation corruption cryptocurrency research enlighten cogent possibility perpetrator commit act basically refer unique characteristic quick value fluctuation difficulty tractability lack current legislation feature headline immensely attractive environment activity world face tangle scamme scandal specify aim highlight commit form unknown
Blockchain and Cryptocurrency The World of Blockchain and Cryptocurrency,"International Journal of Computer Sciences and Engineering (A UGC Approved indexed with DOI, ICI Approved, DPI Digital Library) is one the leading growing open access, peer-reviewed, monthly, scientific research journal for scientists, engineers, scholars, academicians, which gains a foothold in Asia opens to world, aims publish original, theoretical practical advances Science,Information Technology, (Software, Mechanical, Civil, Electronics & Electrical), all interdisciplinary streams Computing Sciences. It intends disseminate scientific, or applied field allied fields. provides platform publishing results strong empirical component. bridge significant gap between practice by promoting publication novel, industry-relevant research.",31-07-2021,International Journal of Computer Sciences and Engineering,https://doi.org/10.26438/ijcse/v9i7.6063,Greeshma C Shekar,0,International Journal of Computer Sciences and Engineering A UGC Approved indexed with DOI ICI Approved DPI Digital Library is one the leading growing open access peerreviewed monthly scientific research journal for scientists engineers scholars academicians which gains a foothold in Asia opens to world aims publish original theoretical practical advances ScienceInformation Technology Software Mechanical Civil Electronics  Electrical all interdisciplinary streams Computing Sciences It intends disseminate scientific or applied field allied fields provides platform publishing results strong empirical component bridge significant gap between practice by promoting publication novel industryrelevant research,international journal computer science engineer ugc approve index doi ici approve dpi digital library lead grow open access peerreviewe monthly scientific research journal scientist engineer scholars academician gain foothold asia open world aim publish original theoretical practical advance scienceinformation technology software mechanical civil electronic electrical interdisciplinary stream computing science intend disseminate scientific applied field ally field provide platform publishing result strong empirical component bridge significant gap practice promote publication novel industryrelevant research
Widespread Virtual Life with Blockchain Deepfake Avatar Cryptocurrency NFT and Metaverse,"The idea of living in different worlds, starting with cinema, can be seen as the beginning virtual world. Because, although limited for a certain period time, cinema and television, which disconnected audience from real world, allowed them to get away life imagine lives. Later, invention internet, power computer increased continued offered users through websites games. With nickname feature, are able take their place v,rtual world identities other than own has also started. This understanding formed basis avatars. Especially games, use avatars each user starts create avatar Big data was created by archiving personal social media, cryptocurrencies deepfake applications developed making more professional reality/augmented reality were users. In research, development this whole process positive negative effects Metaverse, companies such Facebook, Microsoft, Epic, Roblox, Nvidia, Unity Software, continue design rapidly, on people emphasized.",06-06-2022,Uluslararas Kltrel ve Sosyal Aratrmalar Dergisi UKSAD,https://doi.org/10.46442/intjcss.1106228,Mehmet Emin Kahraman,2,The idea of living in different worlds starting with cinema can be seen as the beginning virtual world Because although limited for a certain period time cinema and television which disconnected audience from real world allowed them to get away life imagine lives Later invention internet power computer increased continued offered users through websites games With nickname feature are able take their place vrtual world identities other than own has also started This understanding formed basis avatars Especially games use avatars each user starts create avatar Big data was created by archiving personal social media cryptocurrencies deepfake applications developed making more professional realityaugmented reality were users In research development this whole process positive negative effects Metaverse companies such Facebook Microsoft Epic Roblox Nvidia Unity Software continue design rapidly on people emphasized,idea live different world start cinema see begin virtual world limit certain period time cinema television disconnect audience real world allow away life imagine live later invention internet power computer increase continue offer user website game nickname feature able place vrtual world identitie start understanding form basis avatar especially game use avatar user start create avatar big datum create archive personal social medium cryptocurrencie deepfake application develop make professional realityaugmented reality user research development process positive negative effect metaverse company facebook microsoft epic roblox nvidia unity software continue design rapidly people emphasize
Cryptocurrency Integration Challenges in Blockchain for Financial Institution,"Cryptocurrency is the latest adventure of currencies that works by using new edge technology called blockchain. It has gained notable attention people for last several years across world. also globally known as digital currency or virtual currency, and it a form payment can be used online goods services. Blockchain captured application many in financial industry, including those vigorous transaction, clearing, settlement, with its promise greater efficiency higher resiliency. The been adopted blockchain raised eye-catching sector, government, stakeholders, individuals well. anticipated will future replace fiat money worldwide. Though attracted users' attention, them worried about useability, drawbacks, challenges. Still, research on cryptocurrencies far behind initial stage to integrate these institutes. This lack trust situation sector aggravates further when comes cryptocurrency management challenges are still not critically analyzed. originality this paper concept cryptocurrencies, ecosystem, integration existing institution. help researchers work their system.",30-09-2021,Asian Journal of Electrical and Electronic Engineering,https://doi.org/10.69955/ajoeee.2021.v1i2.18,"M. R. Islam, Muhammad Mahbubur Rahman, Mohammed Ataur Rahman, Muslim Har Sani Mohamad, Abd Halim Embong",1,Cryptocurrency is the latest adventure of currencies that works by using new edge technology called blockchain It has gained notable attention people for last several years across world also globally known as digital currency or virtual currency and it a form payment can be used online goods services Blockchain captured application many in financial industry including those vigorous transaction clearing settlement with its promise greater efficiency higher resiliency The been adopted blockchain raised eyecatching sector government stakeholders individuals well anticipated will future replace fiat money worldwide Though attracted users attention them worried about useability drawbacks challenges Still research on cryptocurrencies far behind initial stage to integrate these institutes This lack trust situation sector aggravates further when comes cryptocurrency management challenges are still not critically analyzed originality this paper concept cryptocurrencies ecosystem integration existing institution help researchers work their system,cryptocurrency late adventure currency work new edge technology call blockchain gain notable attention people year world globally know digital currency virtual currency form payment online good service blockchain capture application financial industry include vigorous transaction clearing settlement promise great efficiency high resiliency adopt blockchain raise eyecatche sector government stakeholder individual anticipate future replace fiat money worldwide attract user attention worried useability drawback challenge research cryptocurrencie far initial stage integrate institute lack trust situation sector aggravate come cryptocurrency management challenge critically analyze originality paper concept cryptocurrencie ecosystem integration exist institution help researcher work system
