Title,Abstract,Publication Date,Journal,Link,Authors,Citations,Cleaned_Abstract,Abstract_Spacy
Novel Payment Wallet Management with Blockchain Based Cryptocurrency,"Blockchain for business is a new concept which enables many industries and organizations to implement even the basic of systems on foundation blockchain technology. Using this technology, our goal develop payments system that transfer funds monetary transaction between two parties. Hyperledger an open source community oriented effort was made propel cross-industry advances were available. The Linux Foundation has it. It partners from everywhere throughout world , at worldwide dimension incorporates ventures like funding, banking, Internet Things, supply chains, assembling Technology. Enterprise we are going makes use regulated cryptocurrency. system, want create cryptocurrency specific payment portal people buy, sell pay or earn rewards using This will majorly consist participants admins be divided based certificates assigned every participant. Our implementation involves. fabric creating run backend involve having regulatory authority maintain cryptocurrency, ledger authenticity users. Theoretically, technology maintains anonymity transactions. uses distributed record transactions able make secure without any repercussions. implements by concepts Trust, Privacy Smart contracts in addition industry friendly application. rapidly growing field with multiple implementations can explored not just but also actual life implementations. Distributed applied systems. Cryptocurrency would now only used anonymous regular day",26-08-2019,International Journal of Recent Technology and Engineering,https://doi.org/10.35940/ijrte.b1042.0782s419,"P. Selvaraj, S. Prabakaran",2,Blockchain for business is a new concept which enables many industries and organizations to implement even the basic of systems on foundation blockchain technology Using this technology our goal develop payments system that transfer funds monetary transaction between two parties Hyperledger an open source community oriented effort was made propel crossindustry advances were available The Linux Foundation has it It partners from everywhere throughout world  at worldwide dimension incorporates ventures like funding banking Internet Things supply chains assembling Technology Enterprise we are going makes use regulated cryptocurrency system want create cryptocurrency specific payment portal people buy sell pay or earn rewards using This will majorly consist participants admins be divided based certificates assigned every participant Our implementation involves fabric creating run backend involve having regulatory authority maintain cryptocurrency ledger authenticity users Theoretically technology maintains anonymity transactions uses distributed record transactions able make secure without any repercussions implements by concepts Trust Privacy Smart contracts in addition industry friendly application rapidly growing field with multiple implementations can explored not just but also actual life implementations Distributed applied systems Cryptocurrency would now only used anonymous regular day,blockchain business new concept enable industry organization implement basic system foundation blockchain technology technology goal develop payment system transfer fund monetary transaction party hyperledger open source community orient effort propel crossindustry advance available linux foundation partner world worldwide dimension incorporate venture like funding banking internet thing supply chain assemble technology enterprise go make use regulate cryptocurrency system want create cryptocurrency specific payment portal people buy sell pay earn reward majorly consist participant admin divide base certificate assign participant implementation involve fabric create run backend involve have regulatory authority maintain cryptocurrency ledger authenticity user theoretically technology maintain anonymity transaction use distribute record transaction able secure repercussion implement concept trust privacy smart contract addition industry friendly application rapidly grow field multiple implementation explore actual life implementation distribute apply system cryptocurrency anonymous regular day
Awareness Trust and Adoption of Blockchain Technology and Cryptocurrency among Blockchain Communities in Malaysia,"Blockchain technology and cryptocurrency are attracting increasing attention from consumers, investors, investment industry regulators. Cryptocurrency has great potential to be used for transaction or in the future. However, level of awareness blockchain is still at infant stage, specifically developing countries. Thus, this study aims investigate awareness, trust adoption among community Malaysia. Quantitative approach was adopted where a new questionnaire developed first phase measure adoption, applications Malaysian communities. The resulting consists items on respondents’ demographic, their trust, FinTech particularly cryptocurrency. In second phase, pilot conducted validated 304 respondents. Reliability test using Cronbach’s alpha with value 0.908. A real survey also queationnaire data were obtained online Descriptive statistics analysis during third study, results demonstrate that intermediate level. Nevertheless, majority respondents confident can offer stable secure platform, which gives positive impact application technology. Empirical provide significant insights into development country.",02-08-2019,International Journal on Advanced Science Engineering and Information Technology,https://doi.org/10.18517/ijaseit.9.4.6280,"Ku Ruhana Ku‐Mahamud, Mazni Omar, Nur Azzah Abu Bakar, Ishola Dada Muraina",37,Blockchain technology and cryptocurrency are attracting increasing attention from consumers investors investment industry regulators Cryptocurrency has great potential to be used for transaction or in the future However level of awareness blockchain is still at infant stage specifically developing countries Thus this study aims investigate awareness trust adoption among community Malaysia Quantitative approach was adopted where a new questionnaire developed first phase measure adoption applications Malaysian communities The resulting consists items on respondents demographic their trust FinTech particularly cryptocurrency In second phase pilot conducted validated 304 respondents Reliability test using Cronbachs alpha with value 0908 A real survey also queationnaire data were obtained online Descriptive statistics analysis during third study results demonstrate that intermediate level Nevertheless majority respondents confident can offer stable secure platform which gives positive impact application technology Empirical provide significant insights into development country,blockchain technology cryptocurrency attract increase attention consumer investor investment industry regulator cryptocurrency great potential transaction future level awareness blockchain infant stage specifically develop country study aim investigate awareness trust adoption community malaysia quantitative approach adopt new questionnaire develop phase measure adoption application malaysian community result consist item respondent demographic trust fintech particularly cryptocurrency second phase pilot conduct validate respondent reliability test cronbachs alpha value real survey queationnaire datum obtain online descriptive statistic analysis study result demonstrate intermediate level majority respondent confident offer stable secure platform give positive impact application technology empirical provide significant insight development country
Blockchain technology cryptocurrencies and transforming accounting fees,"This study investigated the accounting treatment of Bitcoin, considering whether it should be classified as an asset or a currency. The also explored role blockchain technology in promoting transparency and potential separation from Bitcoin. found that cryptocurrencies are significantly impacted by political, economic, regulatory factors. is challenging to control cross-border transactions absence standards. recommends regulators standards setters establish new regulations for cryptocurrencies. Finally, this identifies vast majority existing literature lacking adequate, well-rounded knowledge about access adequate resources, despite their clearly understanding fundamental concepts cryptocurrency. Further, theoretical part paper there some type approach",01-01-2024,International Journal of Electronic Business,https://doi.org/10.1504/ijeb.2024.135657,"Assyad Al Wreikat, Adel Almasarwah, Ola Al Sheyab",2,This study investigated the accounting treatment of Bitcoin considering whether it should be classified as an asset or a currency The also explored role blockchain technology in promoting transparency and potential separation from Bitcoin found that cryptocurrencies are significantly impacted by political economic regulatory factors is challenging to control crossborder transactions absence standards recommends regulators standards setters establish new regulations for cryptocurrencies Finally this identifies vast majority existing literature lacking adequate wellrounded knowledge about access adequate resources despite their clearly understanding fundamental concepts cryptocurrency Further theoretical part paper there some type approach,study investigate accounting treatment bitcoin consider classify asset currency explore role blockchain technology promote transparency potential separation bitcoin find cryptocurrencie significantly impact political economic regulatory factor challenge control crossborder transaction absence standard recommend regulator standard setter establish new regulation cryptocurrencie finally identify vast majority exist literature lack adequate wellrounded knowledge access adequate resource despite clearly understand fundamental concept cryptocurrency theoretical paper type approach
What is Core and What Future Holds for Blockchain Technologies and Cryptocurrencies A Bibliometric Analysis,"A new era awaits the development of cryptocurrency and blockchain technologies. This study highlights influential conceptual aspects literature with bibliometric analysis. There are 1965 related documents from 2015 2020, represent various structures technologies, cryptocurrencies, applications. We have deployed “bibliometrix 3.0”, r-package, VOS viewer to analyze key aspects. IEEE Access is core journal for publications. The University Cagliari, Notreported, Peking affiliations, USA, China, India countries literary research. H. Wang author central theme security It a set basis aspects, core, future research streams themes. proposes three streams: structure cryptocurrencies implications privacy, management data information, optimal information systems. further segregates themes into highly centralized motor that also Topics Consensus protocols, proof work, distribution ledger technology, blockchain, procedures comes under Highly developed emerging considered as stepping stone directions. Underlying topics fintech, Islamic finance, valuations, dynamics cryptocurrencies.",01-01-2021,IEEE Access,https://doi.org/10.1109/access.2020.3046931,"Adeel Nasir, Kamran Shaukat, Kanwal Iqbal Khan, Ibrahim A. Hameed, Talha Mahboob Alam, Suhuai Luo",54,A new era awaits the development of cryptocurrency and blockchain technologies This study highlights influential conceptual aspects literature with bibliometric analysis There are 1965 related documents from 2015 2020 represent various structures technologies cryptocurrencies applications We have deployed bibliometrix 30 rpackage VOS viewer to analyze key aspects IEEE Access is core journal for publications The University Cagliari Notreported Peking affiliations USA China India countries literary research H Wang author central theme security It a set basis aspects core future research streams themes proposes three streams structure cryptocurrencies implications privacy management data information optimal information systems further segregates themes into highly centralized motor that also Topics Consensus protocols proof work distribution ledger technology blockchain procedures comes under Highly developed emerging considered as stepping stone directions Underlying topics fintech Islamic finance valuations dynamics cryptocurrencies,new era await development cryptocurrency blockchain technology study highlight influential conceptual aspect literature bibliometric analysis related document represent structure technology cryptocurrencie application deploy bibliometrix rpackage vos viewer analyze key aspect ieee access core journal publication university cagliari notreporte peke affiliations usa china india countries literary research h wang author central theme security set basis aspect core future research stream theme propose stream structure cryptocurrencie implication privacy management datum information optimal information system segregate theme highly centralize motor topic consensus protocol proof work distribution ledger technology blockchain procedure come highly developed emerge consider stepping stone direction underlie topic fintech islamic finance valuation dynamic cryptocurrencie
Are blockchain and cryptocurrency MampAs harder to close,"We investigate whether distinctive features of the blockchain/cryptocurrency industry led to different completion rates announced mergers and acquisitions (M&As), relative other industries, during years 2013–2022. Despite having a significantly lower deal closure rate on average, we find that this effect is contained only in few does not span entire decade. also bitcoin prices are an important determinant industry's rate. Our findings may help give glimpse into eventual fate most recent deals crypto crash started early 2022.",01-03-2023,Finance Research Letters,https://doi.org/10.1016/j.frl.2022.103500,"Evrim Akdoğu, Şerif Aziz Şimşir",2,We investigate whether distinctive features of the blockchaincryptocurrency industry led to different completion rates announced mergers and acquisitions MAs relative other industries during years 20132022 Despite having a significantly lower deal closure rate on average we find that this effect is contained only in few does not span entire decade also bitcoin prices are an important determinant industrys rate Our findings may help give glimpse into eventual fate most recent deals crypto crash started early 2022,investigate distinctive feature blockchaincryptocurrency industry lead different completion rate announce merger acquisition mas relative industry year despite have significantly low deal closure rate average find effect contain span entire decade bitcoin price important determinant industry rate finding help glimpse eventual fate recent deal crypto crash start early
The Promises of Blockchain and Cryptocurrencies Technology for Architecture and Interaction Design,"Blockchain technology is gaining prominence after its first famous implementation as part of the digital currency Bitcoin. It made up a series blocks (the ledger) that give secure, unchangeable, and auditable list records. Once block recorded using encryption distributed database, it cannot be modified. The ledger in case Bitcoin stores history all monetary transactions. In three sections, this paper provides review blockchain for an interface design audience: (1) fundamentals enable block-chain are briefly discussed. (2) Specific examples include use HCI research development. (3) form fledgling agenda, opportunities difficulties presented.",15-06-2021,International Journal of Advanced Trends in Computer Science and Engineering,https://doi.org/10.30534/ijatcse/2021/1601032021,"Mohamad Hafiz, Waqas Saeed, Waseem Iqbal, Ali Hammad Akbar, Maria Zuraiz, Naveed Shahzad, Manzoor Ahmed Hashmani",2,Blockchain technology is gaining prominence after its first famous implementation as part of the digital currency Bitcoin It made up a series blocks the ledger that give secure unchangeable and auditable list records Once block recorded using encryption distributed database it cannot be modified The ledger in case Bitcoin stores history all monetary transactions In three sections this paper provides review blockchain for an interface design audience 1 fundamentals enable blockchain are briefly discussed 2 Specific examples include use HCI research development 3 form fledgling agenda opportunities difficulties presented,blockchain technology gain prominence famous implementation digital currency bitcoin series block ledger secure unchangeable auditable list record block record encryption distribute database modify ledger case bitcoin store history monetary transaction section paper provide review blockchain interface design audience fundamental enable blockchain briefly discuss specific example include use hci research development form fledgling agenda opportunity difficulty present
Are blockchain and cryptocurrency MampAs harder to close,"We investigate whether distinctive features of the blockchain/cryptocurrency industry led to different completion rates announced mergers and acquisitions (M&As), relative other industries, during years 2013–2022. Despite having a significantly lower deal closure rate on average, we find that this effect is contained only in few does not span entire decade. also bitcoin prices are an important determinant industry's rate. Our findings may help give glimpse into eventual fate most recent deals crypto crash started early 2022.",19-11-2022,Finance Research Letters,https://doi.org/10.1016/j.frl.2022.103500,"Evrim Akdoğu, Şerif Aziz Şimşir",2,We investigate whether distinctive features of the blockchaincryptocurrency industry led to different completion rates announced mergers and acquisitions MAs relative other industries during years 20132022 Despite having a significantly lower deal closure rate on average we find that this effect is contained only in few does not span entire decade also bitcoin prices are an important determinant industrys rate Our findings may help give glimpse into eventual fate most recent deals crypto crash started early 2022,investigate distinctive feature blockchaincryptocurrency industry lead different completion rate announce merger acquisition mas relative industry year despite have significantly low deal closure rate average find effect contain span entire decade bitcoin price important determinant industry rate finding help glimpse eventual fate recent deal crypto crash start early
Cryptoassets The Guide to Bitcoin Blockchain and Cryptocurrency for Investment Professionals,"Bitcoin, blockchain, and cryptocurrencies burst onto the world stage in 2008, when online posting of a pseudonymous white paper provided vision new way to transfer value over internet.In decade-plus since, cryptoasset market has gone through all classic phases disruptive technology: massive bull markets crushing pullbacks, periods euphoria moments despair, FOMO (fear missing out), fear, everything between.As cryptomarket enters its second decade, one thing is clear: Crypto not going away. Cryptoasset are rallying toward all-time highs, many world’s largest investors financial institutions getting involved.Investors looking into crypto, however, face significant challenges. The quality information poor. Theories about drivers valuations untested often poorly designed, they rarely—if ever—published peer-reviewed journals. Due diligence efforts from leading consultants their infancy, few people have carefully thought role (if any) that cryptoassets should professionally managed portfolio.More fundamentally, even understand what crypto really or why it might matter. Is an alternative currency? A technology? venture capital investment? specious bubble?The goal this document provide inquisitive investor with clear-eyed guide blockchain: are, not, where go here.",01-01-2021,SSRN Electronic Journal,https://doi.org/10.2139/ssrn.3792541,"Matt Hougan, David Lawant",2,Bitcoin blockchain and cryptocurrencies burst onto the world stage in 2008 when online posting of a pseudonymous white paper provided vision new way to transfer value over internetIn decadeplus since cryptoasset market has gone through all classic phases disruptive technology massive bull markets crushing pullbacks periods euphoria moments despair FOMO fear missing out fear everything betweenAs cryptomarket enters its second decade one thing is clear Crypto not going away Cryptoasset are rallying toward alltime highs many worlds largest investors financial institutions getting involvedInvestors looking into crypto however face significant challenges The quality information poor Theories about drivers valuations untested often poorly designed they rarelyif everpublished peerreviewed journals Due diligence efforts from leading consultants their infancy few people have carefully thought role if any that cryptoassets should professionally managed portfolioMore fundamentally even understand what crypto really or why it might matter Is an alternative currency A technology venture capital investment specious bubbleThe goal this document provide inquisitive investor with cleareyed guide blockchain are not where go here,bitcoin blockchain cryptocurrencie burst world stage online posting pseudonymous white paper provide vision new way transfer value internetin decadeplus cryptoasset market go classic phase disruptive technology massive bull market crush pullback period euphoria moment despair fomo fear miss fear betweena cryptomarket enter second decade thing clear crypto go away cryptoasset rally alltime high world large investor financial institution get involvedinvestor look crypto face significant challenge quality information poor theory driver valuation untested poorly design rarelyif everpublishe peerreviewed journal diligence effort lead consultant infancy people carefully think role cryptoasset professionally manage portfoliomore fundamentally understand crypto matter alternative currency technology venture capital investment specious bubblethe goal document provide inquisitive investor cleareye guide blockchain
Creating allwin by blockchain technology in supply chains Impacts of agents risk attitudes towards cryptocurrency,"Today, blockchain technology and its cryptocurrency function are widely proposed as a tool for supply chain finance some companies already accept in business transactions. However, agents may possess different risk attitudes towards the use of cryptocurrency. In this paper, we build stylised analytical three-echelon models to examine issue. To be specific, consider case which can neutral, averse or prone volatile value We model these by using mean-risk theory. main models, comparing benefits well consumers under cases with without cryptocurrency, analytically reveal impacts brought echelons. find conditions implementing achieves an all-win situation all consumers. Critical factors affect adoption chains further investigated. extended two cases: (i) The “not cryptocurrency” has impact on consumer utility; (ii) there is chain-to-chain competition. uncover that conclusion remains valid new insights also derived.",20-08-2020,Journal of the Operational Research Society,https://doi.org/10.1080/01605682.2020.1800419,Tsan‐Ming Choi,63,Today blockchain technology and its cryptocurrency function are widely proposed as a tool for supply chain finance some companies already accept in business transactions However agents may possess different risk attitudes towards the use of cryptocurrency In this paper we build stylised analytical threeechelon models to examine issue To be specific consider case which can neutral averse or prone volatile value We model these by using meanrisk theory main models comparing benefits well consumers under cases with without cryptocurrency analytically reveal impacts brought echelons find conditions implementing achieves an allwin situation all consumers Critical factors affect adoption chains further investigated extended two cases i The not cryptocurrency has impact on consumer utility ii there is chaintochain competition uncover that conclusion remains valid new insights also derived,today blockchain technology cryptocurrency function widely propose tool supply chain finance company accept business transaction agent possess different risk attitude use cryptocurrency paper build stylise analytical threeechelon model examine issue specific consider case neutral averse prone volatile value model meanrisk theory main model compare benefit consumer case cryptocurrency analytically reveal impact bring echelon find condition implement achieve allwin situation consumer critical factor affect adoption chain investigate extend case cryptocurrency impact consumer utility ii chaintochain competition uncover conclusion remain valid new insight derive
